{
  "proof": "0xdeadbeef",
  "startBlockNumber": 1000501,
  "endBlockNumber": 1000503,
  "publicInputs": {
    "parentBlockHash": "0x0a0a0a0a0a0a0a0a0a0a0a0a0a0a0a0a0a0a0a0a0a0a0a0a0a0a0a0a0a0a0a0a",
    "endBlockHash": "0x0b0b0b0b0b0b0b0b0b0b0b0b0b0b0b0b0b0b0b0b0b0b0b0b0b0b0b0b0b0b0b0b",
    "endBlockNumber": 1000503,
    "endBlockTimestamp": 1763000123,
    "l2L1MessagesHash": "0x0101010101010101010101010101010101010101010101010101010101010101",
    "parentL1L2BridgeRollingHash": "0x0202020202020202020202020202020202020202020202020202020202020202",
    "parentL1L2BridgeRollingHashMessageNumber": 0,
    "endL1L2BridgeRollingHash": "0x0303030303030303030303030303030303030303030303030303030303030303",
    "endL1L2BridgeRollingHashMessageNumber": 5,
    "dynamicChainConfigHash": "0xc0c0c0c0c0c0c0c0c0c0c0c0c0c0c0c0c0c0c0c0c0c0c0c0c0c0c0c0c0c0c0c0",
    "parentFtxRollingHash": "0x0404040404040404040404040404040404040404040404040404040404040404",
    "endFtxRollingHash": "0x0505050505050505050505050505050505050505050505050505050505050505",
    "lastProcessedFtxNumber": 18,
    "filteredAddressesHash": "0x0606060606060606060606060606060606060606060606060606060606060606",
    "txFromsHash": "0x0707070707070707070707070707070707070707070707070707070707070707"
  },
  "l2L1Messages": [
    "0x0808080808080808080808080808080808080808080808080808080808080808"
  ],
  "txFroms": [
    "0x0101010101010101010101010101010101010101",
    "0x0202020202020202020202020202020202020202"
  ],
  "filteredAddresses": [
    "0x0909090909090909090909090909090909090909"
  ]
}
